{
  "$schema": "https://json-schema.org/draft/2020-12/schema",
  "title": "Axis layer",
  "type": "object",
  "additionalProperties": false,
  "required": ["id", "kind", "formatVersion", "target", "changes"],
  "properties": {
    "id": { "$ref": "#/$defs/id" },
    "kind": { "const": "layer" },
    "formatVersion": { "const": 1 },
    "target": {
      "type": "string",
      "pattern": "^[a-z][a-z0-9-]*/[A-Za-z][A-Za-z0-9]*$"
    },
    "changes": { "type": "object" }
  },
  "$defs": {
    "id": {
      "type": "string",
      "format": "uuid",
      "pattern": "^[0-9a-fA-F]{8}-[0-9a-fA-F]{4}-[0-9a-fA-F]{4}-[0-9a-fA-F]{4}-[0-9a-fA-F]{12}$"
    }
  }
}
