{
  "id": "7a2f4c61-1b3d-4e58-8a9c-5d0e2f7b3f05",
  "kind": "layer",
  "formatVersion": 1,
  "target": "intake/IntakeForm",
  "changes": {
    "sections": [
      {
        "title": { "textKey": "intake.intakeForm.title" },
        "fields": [{ "field": "title" }, { "field": "notes" }]
      }
    ]
  }
}
